{"schema_version": 3, "generado": "2026-08-30T19:19:01+00:00", "fuentes": {"dinagua_wfs": "caida", "salto_grande": "ok", "inumet_lluvia": "ok", "inia_lluvia": "caida", "ina": "ok", "ute_rio_negro": "ok", "ana": "ok", "sohma": "ok", "caru": "no_implementada"}, "fuentes_detalle": {"dinagua_wfs": {"estado": "caida", "ultima_observacion": "2026-08-27T09:00:00Z", "ultimo_exito": "2026-08-27T14:00:51+00:00"}, "salto_grande": {"estado": "ok", "ultima_observacion": "2026-08-30T15:00-03:00", "ultimo_exito": "2026-08-30T19:19:01+00:00"}, "inumet_lluvia": {"estado": "ok", "ultima_observacion": "2026-08-30T04:00+00:00", "ultimo_exito": "2026-08-30T19:19:01+00:00"}, "inia_lluvia": {"estado": "caida", "ultima_observacion": null, "ultimo_exito": null}, "ina": {"estado": "ok", "ultima_observacion": "2026-08-30T15:00-03:00", "ultimo_exito": "2026-08-30T19:19:01+00:00"}, "ute_rio_negro": {"estado": "ok", "ultima_observacion": "2026-08-30T09:27-03:00", "ultimo_exito": "2026-08-30T19:19:01+00:00"}, "ana": {"estado": "ok", "ultima_observacion": "2026-08-30T15:15-03:00", "ultimo_exito": "2026-08-30T19:19:01+00:00"}, "sohma": {"estado": "ok", "ultima_observacion": "2026-08-30T16:10-03:00", "ultimo_exito": "2026-08-30T19:19:01+00:00"}, "caru": {"estado": "no_implementada", "ultima_observacion": null, "ultimo_exito": null}}, "estaciones": [{"id": 184, "nombre": "Mercedes (Puerto)", "curso": "Río Negro", "tipo": "Hidrométrica", "clasificacion": "observado", "oficial": true, "fuente": "DINAGUA", "lat": -33.24592, "lon": -58.03851, "q_medio": 1005.252, "codigo5": 58830, "nivel": null, "nivel_fecha": null, "nivel_horas": null, "caudal": null, "caudal_fecha": null, "caudal_horas": null, "factor": null, "qc_nivel": {"estado": "sin_dato", "codigos": ["sin_dato"], "apto_informativo": false, "apto_derivados": false, "antiguedad_h": null, "controles": ["valor_finito", "fecha", "rango_fisico"], "referencia": {"valor": 0.9, "fecha": "2022-04-20T10:00+00:00"}}, "qc_caudal": {"estado": "sin_dato", "codigos": ["sin_dato"], "apto_informativo": false, "apto_derivados": false, "antiguedad_h": null, "controles": ["valor_finito", "fecha", "rango_fisico"], "referencia": {"valor": 1157.52, "fecha": "2020-12-31T23:00+00:00"}}, "estacion_id": "dinagua-184", "slug": "mercedes-puerto"}, {"id": 189, "nombre": "Paso de los Toros", "curso": "Río Negro", "tipo": "Limnimétrica", "clasificacion": "observado", "oficial": true, "fuente": "DINAGUA", "lat": -32.8204, "lon": -56.51116, "q_medio": 626.023, "codigo5": 55135, "nivel": null, "nivel_fecha": null, "nivel_horas": null, "caudal": null, "caudal_fecha": null, "caudal_horas": null, "factor": null, "qc_nivel": {"estado": "sin_dato", "codigos": ["sin_dato"], "apto_informativo": false, "apto_derivados": false, "antiguedad_h": null, "controles": ["valor_finito", "fecha", "rango_fisico"], "referencia": {"valor": 7.6, "fecha": "2026-07-31T18:00+00:00"}}, "qc_caudal": {"estado": "sin_dato", "codigos": ["sin_dato"], "apto_informativo": false, "apto_derivados": false, "antiguedad_h": null, "controles": ["valor_finito", "fecha", "rango_fisico"], "referencia": null}, "estacion_id": "dinagua-189", "slug": "paso-de-los-toros"}, {"id": 1938, "nombre": "Paso Ramírez", "curso": "Río Negro", "tipo": "Limnimétrica", "clasificacion": "observado", "oficial": true, "fuente": "DINAGUA", "lat": -32.50501, "lon": -55.50542, "q_medio": 482.603, "codigo5": 54000, "nivel": null, "nivel_fecha": null, "nivel_horas": null, "caudal": null, "caudal_fecha": null, "caudal_horas": null, "factor": null, "qc_nivel": {"estado": "sin_dato", "codigos": ["sin_dato"], "apto_informativo": false, "apto_derivados": false, "antiguedad_h": null, "controles": ["valor_finito", "fecha", "rango_fisico"], "referencia": {"valor": 2.0, "fecha": "2026-06-30T17:30+00:00"}}, "qc_caudal": {"estado": "sin_dato", "codigos": ["sin_dato"], "apto_informativo": false, "apto_derivados": false, "antiguedad_h": null, "controles": ["valor_finito", "fecha", "rango_fisico"], "referencia": null}, "estacion_id": "dinagua-1938", "slug": "paso-ramirez"}, {"id": 194, "nombre": "Paso Pereira", "curso": "Río Negro", "tipo": "Limnimétrica", "clasificacion": "observado", "oficial": true, "fuente": "DINAGUA", "lat": -32.44509, "lon": -55.22761, "q_medio": 130.455, "codigo5": 50835, "nivel": null, "nivel_fecha": null, "nivel_horas": null, "caudal": null, "caudal_fecha": null, "caudal_horas": null, "factor": null, "qc_nivel": {"estado": "sin_dato", "codigos": ["sin_dato"], "apto_informativo": false, "apto_derivados": false, "antiguedad_h": null, "controles": ["valor_finito", "fecha", "rango_fisico"], "referencia": {"valor": 1.76, "fecha": "2025-11-28T17:00+00:00"}}, "qc_caudal": {"estado": "sin_dato", "codigos": ["sin_dato"], "apto_informativo": false, "apto_derivados": false, "antiguedad_h": null, "controles": ["valor_finito", "fecha", "rango_fisico"], "referencia": null}, "estacion_id": "dinagua-194", "slug": "paso-pereira"}, {"id": 198, "nombre": "Treinta y Tres (R.8)", "curso": "Río Olimar Grande", "tipo": "Hidrométrica + T", "clasificacion": "observado", "oficial": true, "fuente": "DINAGUA", "lat": -33.24204, "lon": -54.40196, "q_medio": 80.43, "codigo5": 43770, "nivel": null, "nivel_fecha": null, "nivel_horas": null, "caudal": null, "caudal_fecha": null, "caudal_horas": null, "factor": null, "qc_nivel": {"estado": "sin_dato", "codigos": ["sin_dato"], "apto_informativo": false, "apto_derivados": false, "antiguedad_h": null, "controles": ["valor_finito", "fecha", "rango_fisico"], "referencia": {"valor": 2.87, "fecha": "2026-08-27T00:00+00:00"}}, "qc_caudal": {"estado": "sin_dato", "codigos": ["sin_dato"], "apto_informativo": false, "apto_derivados": false, "antiguedad_h": null, "controles": ["valor_finito", "fecha", "rango_fisico"], "referencia": {"valor": 136.13, "fecha": "2026-08-27T00:00+00:00"}}, "estacion_id": "dinagua-198", "slug": "treinta-y-tres-r-8"}, {"id": 201, "nombre": "La Charqueada", "curso": "Río Cebollatí", "tipo": "Limnimétrica + T + P", "clasificacion": "observado", "oficial": true, "fuente": "DINAGUA", "lat": -33.2086, "lon": -53.80037, "q_medio": 227.632, "codigo5": 44800, "nivel": null, "nivel_fecha": null, "nivel_horas": null, "caudal": null, "caudal_fecha": null, "caudal_horas": null, "factor": null, "qc_nivel": {"estado": "sin_dato", "codigos": ["sin_dato"], "apto_informativo": false, "apto_derivados": false, "antiguedad_h": null, "controles": ["valor_finito", "fecha", "rango_fisico"], "referencia": {"valor": 0.85, "fecha": "2026-06-30T17:30+00:00"}}, "qc_caudal": {"estado": "sin_dato", "codigos": ["sin_dato"], "apto_informativo": false, "apto_derivados": false, "antiguedad_h": null, "controles": ["valor_finito", "fecha", "rango_fisico"], "referencia": null}, "estacion_id": "dinagua-201", "slug": "la-charqueada"}, {"id": 202, "nombre": "Picada de Corbo", "curso": "Río Cebollatí", "tipo": "Hidrométrica + T", "clasificacion": "observado", "oficial": true, "fuente": "DINAGUA", "lat": -33.83007, "lon": -54.76891, "q_medio": 41.964, "codigo5": 44409, "nivel": null, "nivel_fecha": null, "nivel_horas": null, "caudal": null, "caudal_fecha": null, "caudal_horas": null, "factor": null, "qc_nivel": {"estado": "sin_dato", "codigos": ["sin_dato"], "apto_informativo": false, "apto_derivados": false, "antiguedad_h": null, "controles": ["valor_finito", "fecha", "rango_fisico"], "referencia": {"valor": 0.25, "fecha": "2026-05-20T12:45+00:00"}}, "qc_caudal": {"estado": "sin_dato", "codigos": ["sin_dato"], "apto_informativo": false, "apto_derivados": false, "antiguedad_h": null, "controles": ["valor_finito", "fecha", "rango_fisico"], "referencia": {"valor": 1.53, "fecha": "2026-05-20T12:45+00:00"}}, "estacion_id": "dinagua-202", "slug": "picada-de-corbo"}, {"id": 203, "nombre": "Paso Averías", "curso": "Río Cebollatí", "tipo": "Hidrométrica + T + P", "clasificacion": "observado", "oficial": true, "fuente": "DINAGUA", "lat": -33.61328, "lon": -54.32923, "q_medio": 113.702, "codigo5": 44570, "nivel": null, "nivel_fecha": null, "nivel_horas": null, "caudal": null, "caudal_fecha": null, "caudal_horas": null, "factor": null, "qc_nivel": {"estado": "sin_dato", "codigos": ["sin_dato"], "apto_informativo": false, "apto_derivados": false, "antiguedad_h": null, "controles": ["valor_finito", "fecha", "rango_fisico"], "referencia": {"valor": 1.71, "fecha": "2025-07-07T17:00+00:00"}}, "qc_caudal": {"estado": "sin_dato", "codigos": ["sin_dato"], "apto_informativo": false, "apto_derivados": false, "antiguedad_h": null, "controles": ["valor_finito", "fecha", "rango_fisico"], "referencia": {"valor": 28.12, "fecha": "2025-07-07T17:00+00:00"}}, "estacion_id": "dinagua-203", "slug": "paso-averias"}, {"id": 205, "nombre": "Río Branco", "curso": "Río Yaguarón", "tipo": "Limnimétrica", "clasificacion": "observado", "oficial": true, "fuente": "DINAGUA", "lat": -32.57438, "lon": -53.37771, "q_medio": 142.216, "codigo5": 40690, "nivel": null, "nivel_fecha": null, "nivel_horas": null, "caudal": null, "caudal_fecha": null, "caudal_horas": null, "factor": null, "qc_nivel": {"estado": "sin_dato", "codigos": ["sin_dato"], "apto_informativo": false, "apto_derivados": false, "antiguedad_h": null, "controles": ["valor_finito", "fecha", "rango_fisico"], "referencia": {"valor": 0.7, "fecha": "2025-12-31T17:00+00:00"}}, "qc_caudal": {"estado": "sin_dato", "codigos": ["sin_dato"], "apto_informativo": false, "apto_derivados": false, "antiguedad_h": null, "controles": ["valor_finito", "fecha", "rango_fisico"], "referencia": null}, "estacion_id": "dinagua-205", "slug": "rio-branco"}, {"id": 206, "nombre": "Puente Mauá", "curso": "Río Yaguarón", "tipo": "Limnimétrica + T + P", "clasificacion": "observado", "oficial": true, "fuente": "DINAGUA", "lat": -32.57186, "lon": -53.37708, "q_medio": 142.216, "codigo5": 40690, "nivel": null, "nivel_fecha": null, "nivel_horas": null, "caudal": null, "caudal_fecha": null, "caudal_horas": null, "factor": null, "qc_nivel": {"estado": "sin_dato", "codigos": ["sin_dato"], "apto_informativo":